{
  "id": "module-3-ai-robot-brain",
  "title": "AI-Robot Brain",
  "order": 3,
  "description": "Delve into the AI-driven brain of robots, exploring advanced simulation platforms and perception techniques like VSLAM.",
  "prerequisites": ["chapter-1-ros2-basics", "chapter-1-gazebo-physics"],
  "learningObjectives": [
    "Understand NVIDIA Isaac Sim capabilities for robotics simulation",
    "Learn about VSLAM and its role in robot perception",
    "Explore navigation stack integration for autonomous robots"
  ]
}