{
  "id": "module-4-vision-language-action",
  "title": "Vision-Language-Action",
  "order": 4,
  "description": "Explore the convergence of vision, language, and robotic action, enabling robots to understand and interact with the world through human-like communication and cognitive planning.",
  "prerequisites": ["chapter-2-vslam-navigation"],
  "learningObjectives": [
    "Understand the principles of cognitive planning for robots",
    "Explore Vision-Language Models (VLMs) and their application in robotics",
    "Learn to integrate speech recognition (e.g., Whisper) for natural language interaction"
  ]
}